{
  "$schema": "https://cdn.jsdelivr.net/gh/forge-arcana/kos-data@main/schema/athlete.schema.json",
  "dataset": "athlete",
  "sport": "f1",
  "entity": "athlete/alex-zanardi",
  "updated": "2026-09-27T15:53:47.811Z",
  "sources": [
    "f1db"
  ],
  "identity": {
    "name": "Alex Zanardi",
    "aliases": [],
    "qid": null,
    "country": "ITA",
    "dob": "1966-10-23",
    "sourceIds": {
      "f1db": "alex-zanardi"
    }
  },
  "aggregates": [
    {
      "metric": "agg.championships",
      "scope": "career",
      "value": 0,
      "unit": "count",
      "provenance": "sourced",
      "cites": [
        "kos:f1/career/2026-09-27#athlete/alex-zanardi.agg.championships"
      ]
    },
    {
      "metric": "agg.fastest_laps",
      "scope": "career",
      "value": 0,
      "unit": "count",
      "provenance": "sourced",
      "cites": [
        "kos:f1/career/2026-09-27#athlete/alex-zanardi.agg.fastest_laps"
      ]
    },
    {
      "metric": "agg.podiums",
      "scope": "career",
      "value": 0,
      "unit": "count",
      "provenance": "sourced",
      "cites": [
        "kos:f1/career/2026-09-27#athlete/alex-zanardi.agg.podiums"
      ]
    },
    {
      "metric": "agg.points",
      "scope": "career",
      "value": 1,
      "unit": "points",
      "provenance": "sourced",
      "cites": [
        "kos:f1/career/2026-09-27#athlete/alex-zanardi.agg.points"
      ]
    },
    {
      "metric": "agg.poles",
      "scope": "career",
      "value": 0,
      "unit": "count",
      "provenance": "sourced",
      "cites": [
        "kos:f1/career/2026-09-27#athlete/alex-zanardi.agg.poles"
      ]
    },
    {
      "metric": "agg.starts",
      "scope": "career",
      "value": 41,
      "unit": "count",
      "provenance": "sourced",
      "cites": [
        "kos:f1/career/2026-09-27#athlete/alex-zanardi.agg.starts"
      ]
    },
    {
      "metric": "agg.wins",
      "scope": "career",
      "value": 0,
      "unit": "count",
      "provenance": "sourced",
      "cites": [
        "kos:f1/career/2026-09-27#athlete/alex-zanardi.agg.wins"
      ]
    },
    {
      "metric": "agg.points",
      "scope": "f1/1993",
      "value": 1,
      "unit": "points",
      "provenance": "sourced",
      "cites": [
        "kos:f1/1993#athlete/alex-zanardi.agg.points@season"
      ]
    },
    {
      "metric": "win_rate",
      "scope": "career",
      "value": 0,
      "provenance": "derived",
      "derivation": "win_rate@1.0.0",
      "rowCount": 42,
      "cites": []
    }
  ],
  "recent": [
    {
      "event": "f1/1999/wc/r12-belgian-gp",
      "date": "1999-08-29",
      "position": 8,
      "ref": "kos:f1/1999/wc/r12-belgian-gp/race#athlete/alex-zanardi.result.position"
    },
    {
      "event": "f1/1999/wc/r13-italian-gp",
      "date": "1999-09-12",
      "position": 7,
      "ref": "kos:f1/1999/wc/r13-italian-gp/race#athlete/alex-zanardi.result.position"
    },
    {
      "event": "f1/1999/wc/r14-european-gp",
      "date": "1999-09-26",
      "ref": "kos:f1/1999/wc/r14-european-gp/race#athlete/alex-zanardi.meas.fastest_lap_ms"
    },
    {
      "event": "f1/1999/wc/r15-malaysian-gp",
      "date": "1999-10-17",
      "position": 10,
      "ref": "kos:f1/1999/wc/r15-malaysian-gp/race#athlete/alex-zanardi.result.position"
    },
    {
      "event": "f1/1999/wc/r16-japanese-gp",
      "date": "1999-10-31",
      "ref": "kos:f1/1999/wc/r16-japanese-gp/race#athlete/alex-zanardi.perf.pit_stops"
    }
  ],
  "series": {},
  "coverage": {
    "result": {
      "status": "full",
      "floor": "1950",
      "note": "f1db CC BY backbone: every world-championship session 1950-present."
    },
    "perf": {
      "status": "partial",
      "floor": "1994",
      "note": "Pit-stop counts from f1db's pit-stop data era (1994+); earlier races have no per-stop records.",
      "wouldUnblock": "A licensed historical pit-stop dataset for pre-1994 seasons."
    },
    "form": {
      "status": "full",
      "floor": "1950",
      "note": "Drivers' standings after every round, f1db 1950-present."
    },
    "cond": {
      "status": "partial",
      "floor": "1950",
      "note": "Open-Meteo hourly reanalysis joined by venue coordinates; model estimate at the venue, not track-side sensor data.",
      "proxies": [
        "cond.temp_c",
        "cond.precip_mm",
        "cond.wind_kmh"
      ]
    },
    "avail": {
      "status": "none",
      "note": "No keyless personnel-status feed exists for F1; driver substitutions surface only post-hoc in results.",
      "wouldUnblock": "A licensed entry-list/withdrawal feed."
    },
    "market": {
      "status": "partial",
      "floor": "2024",
      "note": "Prediction markets (Polymarket) 2024-present only; no keyless bookmaker odds history for F1. Public per owner decision 2026-07-19 (OQ #6 closed: rights unlocated, not denied); excluded from commercial delivery.",
      "wouldUnblock": "A licensed historical odds feed would extend the floor past 2024."
    },
    "meas": {
      "status": "partial",
      "floor": "1950",
      "note": "Fastest race lap from f1db (stepped horizon: timing precision improves by era). Speed-trap and telemetry measurements have no license-clean source (SR G7).",
      "wouldUnblock": "A licensed telemetry/speed-trap dataset."
    },
    "agg": {
      "status": "full",
      "floor": "1950",
      "note": "f1db source-published driver season and career totals; independent cross-check for card-derived aggregates."
    },
    "h2h": {
      "status": "full",
      "note": "Derived-only from stored result rows over shared events; no stored metric (OM §14.1)."
    }
  }
}
