{
  "$schema": "https://cdn.jsdelivr.net/gh/forge-arcana/kos-data@main/schema/athlete.schema.json",
  "dataset": "athlete",
  "sport": "f1",
  "entity": "athlete/umberto-maglioli",
  "updated": "2026-10-12T02:54:15.598Z",
  "sources": [
    "f1db"
  ],
  "identity": {
    "name": "Umberto Maglioli",
    "aliases": [],
    "qid": "Q113327",
    "country": "ITA",
    "dob": "1928-06-05",
    "sourceIds": {
      "f1db": "umberto-maglioli"
    }
  },
  "aggregates": [
    {
      "metric": "agg.championships",
      "scope": "career",
      "value": 0,
      "unit": "count",
      "provenance": "sourced",
      "cites": [
        "kos:f1/career/2026-10-12#athlete/umberto-maglioli.agg.championships"
      ]
    },
    {
      "metric": "agg.fastest_laps",
      "scope": "career",
      "value": 0,
      "unit": "count",
      "provenance": "sourced",
      "cites": [
        "kos:f1/career/2026-10-12#athlete/umberto-maglioli.agg.fastest_laps"
      ]
    },
    {
      "metric": "agg.podiums",
      "scope": "career",
      "value": 2,
      "unit": "count",
      "provenance": "sourced",
      "cites": [
        "kos:f1/career/2026-10-12#athlete/umberto-maglioli.agg.podiums"
      ]
    },
    {
      "metric": "agg.points",
      "scope": "career",
      "value": 3.33,
      "unit": "points",
      "provenance": "sourced",
      "cites": [
        "kos:f1/career/2026-10-12#athlete/umberto-maglioli.agg.points"
      ]
    },
    {
      "metric": "agg.poles",
      "scope": "career",
      "value": 0,
      "unit": "count",
      "provenance": "sourced",
      "cites": [
        "kos:f1/career/2026-10-12#athlete/umberto-maglioli.agg.poles"
      ]
    },
    {
      "metric": "agg.starts",
      "scope": "career",
      "value": 10,
      "unit": "count",
      "provenance": "sourced",
      "cites": [
        "kos:f1/career/2026-10-12#athlete/umberto-maglioli.agg.starts"
      ]
    },
    {
      "metric": "agg.wins",
      "scope": "career",
      "value": 0,
      "unit": "count",
      "provenance": "sourced",
      "cites": [
        "kos:f1/career/2026-10-12#athlete/umberto-maglioli.agg.wins"
      ]
    },
    {
      "metric": "agg.points",
      "scope": "f1/1954",
      "value": 2,
      "unit": "points",
      "provenance": "sourced",
      "cites": [
        "kos:f1/1954#athlete/umberto-maglioli.agg.points@season"
      ]
    },
    {
      "metric": "agg.points",
      "scope": "f1/1955",
      "value": 1.33,
      "unit": "points",
      "provenance": "sourced",
      "cites": [
        "kos:f1/1955#athlete/umberto-maglioli.agg.points@season"
      ]
    },
    {
      "metric": "podiums",
      "scope": "career",
      "value": 2,
      "provenance": "derived",
      "derivation": "podiums@1.0.0",
      "rowCount": 2,
      "cites": [
        "kos:f1/1954/wc/r08-italian-gp/race#athlete/umberto-maglioli.result.position",
        "kos:f1/1955/wc/r01-argentine-gp/race#athlete/umberto-maglioli.result.position"
      ]
    },
    {
      "metric": "win_rate",
      "scope": "career",
      "value": 0,
      "provenance": "derived",
      "derivation": "win_rate@1.0.0",
      "rowCount": 10,
      "cites": []
    }
  ],
  "recent": [
    {
      "event": "f1/1955/wc/r07-italian-gp",
      "date": "1955-09-11",
      "position": 6,
      "ref": "kos:f1/1955/wc/r07-italian-gp/race#athlete/umberto-maglioli.result.position"
    },
    {
      "event": "f1/1956/wc/r06-british-gp",
      "date": "1956-07-14",
      "ref": "kos:f1/1956/wc/r06-british-gp/race#athlete/umberto-maglioli.result.grid"
    },
    {
      "event": "f1/1956/wc/r07-german-gp",
      "date": "1956-08-05",
      "ref": "kos:f1/1956/wc/r07-german-gp/race#athlete/umberto-maglioli.result.grid"
    },
    {
      "event": "f1/1956/wc/r08-italian-gp",
      "date": "1956-09-02",
      "ref": "kos:f1/1956/wc/r08-italian-gp/race#athlete/umberto-maglioli.result.grid"
    },
    {
      "event": "f1/1957/wc/r06-german-gp",
      "date": "1957-08-04",
      "ref": "kos:f1/1957/wc/r06-german-gp/race#athlete/umberto-maglioli.result.grid"
    }
  ],
  "series": {},
  "coverage": {
    "result": {
      "status": "full",
      "floor": "1950",
      "note": "f1db CC BY backbone: every world-championship session 1950-present."
    },
    "perf": {
      "status": "partial",
      "floor": "1994",
      "note": "Pit-stop counts from f1db's pit-stop data era (1994+); earlier races have no per-stop records.",
      "wouldUnblock": "A licensed historical pit-stop dataset for pre-1994 seasons."
    },
    "form": {
      "status": "full",
      "floor": "1950",
      "note": "Drivers' standings after every round, f1db 1950-present."
    },
    "cond": {
      "status": "partial",
      "floor": "1950",
      "note": "Open-Meteo hourly reanalysis joined by venue coordinates; model estimate at the venue, not track-side sensor data.",
      "proxies": [
        "cond.temp_c",
        "cond.precip_mm",
        "cond.wind_kmh"
      ]
    },
    "avail": {
      "status": "none",
      "note": "No keyless personnel-status feed exists for F1; driver substitutions surface only post-hoc in results.",
      "wouldUnblock": "A licensed entry-list/withdrawal feed."
    },
    "market": {
      "status": "partial",
      "floor": "2024",
      "note": "Prediction markets (Polymarket) 2024-present only; no keyless bookmaker odds history for F1. Public per owner decision 2026-07-19 (OQ #6 closed: rights unlocated, not denied); excluded from commercial delivery.",
      "wouldUnblock": "A licensed historical odds feed would extend the floor past 2024."
    },
    "meas": {
      "status": "partial",
      "floor": "1950",
      "note": "Fastest race lap from f1db (stepped horizon: timing precision improves by era). Speed-trap and telemetry measurements have no license-clean source (SR G7).",
      "wouldUnblock": "A licensed telemetry/speed-trap dataset."
    },
    "agg": {
      "status": "full",
      "floor": "1950",
      "note": "f1db source-published driver season and career totals; independent cross-check for card-derived aggregates."
    },
    "h2h": {
      "status": "full",
      "note": "Derived-only from stored result rows over shared events; no stored metric (OM §14.1)."
    }
  }
}
