{
  "$schema": "https://cdn.jsdelivr.net/gh/forge-arcana/kos-data@main/schema/athlete.schema.json",
  "dataset": "athlete",
  "sport": "f1",
  "entity": "athlete/nikita-mazepin",
  "updated": "2026-10-26T17:45:17.184Z",
  "sources": [
    "f1db"
  ],
  "identity": {
    "name": "Nikita Mazepin",
    "aliases": [],
    "qid": "Q22008968",
    "country": "RUS",
    "dob": "1999-03-02",
    "sourceIds": {
      "f1db": "nikita-mazepin"
    }
  },
  "aggregates": [
    {
      "metric": "agg.championships",
      "scope": "career",
      "value": 0,
      "unit": "count",
      "provenance": "sourced",
      "cites": [
        "kos:f1/career/2026-10-26#athlete/nikita-mazepin.agg.championships"
      ]
    },
    {
      "metric": "agg.fastest_laps",
      "scope": "career",
      "value": 0,
      "unit": "count",
      "provenance": "sourced",
      "cites": [
        "kos:f1/career/2026-10-26#athlete/nikita-mazepin.agg.fastest_laps"
      ]
    },
    {
      "metric": "agg.podiums",
      "scope": "career",
      "value": 0,
      "unit": "count",
      "provenance": "sourced",
      "cites": [
        "kos:f1/career/2026-10-26#athlete/nikita-mazepin.agg.podiums"
      ]
    },
    {
      "metric": "agg.points",
      "scope": "career",
      "value": 0,
      "unit": "points",
      "provenance": "sourced",
      "cites": [
        "kos:f1/career/2026-10-26#athlete/nikita-mazepin.agg.points"
      ]
    },
    {
      "metric": "agg.poles",
      "scope": "career",
      "value": 0,
      "unit": "count",
      "provenance": "sourced",
      "cites": [
        "kos:f1/career/2026-10-26#athlete/nikita-mazepin.agg.poles"
      ]
    },
    {
      "metric": "agg.starts",
      "scope": "career",
      "value": 21,
      "unit": "count",
      "provenance": "sourced",
      "cites": [
        "kos:f1/career/2026-10-26#athlete/nikita-mazepin.agg.starts"
      ]
    },
    {
      "metric": "agg.wins",
      "scope": "career",
      "value": 0,
      "unit": "count",
      "provenance": "sourced",
      "cites": [
        "kos:f1/career/2026-10-26#athlete/nikita-mazepin.agg.wins"
      ]
    },
    {
      "metric": "agg.points",
      "scope": "f1/2021",
      "value": 0,
      "unit": "points",
      "provenance": "sourced",
      "cites": [
        "kos:f1/2021#athlete/nikita-mazepin.agg.points@season"
      ]
    },
    {
      "metric": "win_rate",
      "scope": "career",
      "value": 0,
      "provenance": "derived",
      "derivation": "win_rate@1.0.0",
      "rowCount": 22,
      "cites": []
    }
  ],
  "recent": [
    {
      "event": "f1/2021/wc/r18-mexican-gp",
      "date": "2021-11-07",
      "position": 18,
      "ref": "kos:f1/2021/wc/r18-mexican-gp/race#athlete/nikita-mazepin.result.position"
    },
    {
      "event": "f1/2021/wc/r19-sao-paulo-gp",
      "date": "2021-11-14",
      "position": 17,
      "ref": "kos:f1/2021/wc/r19-sao-paulo-gp/race#athlete/nikita-mazepin.result.position"
    },
    {
      "event": "f1/2021/wc/r20-qatar-gp",
      "date": "2021-11-21",
      "position": 18,
      "ref": "kos:f1/2021/wc/r20-qatar-gp/race#athlete/nikita-mazepin.result.position"
    },
    {
      "event": "f1/2021/wc/r21-saudi-arabian-gp",
      "date": "2021-12-05",
      "ref": "kos:f1/2021/wc/r21-saudi-arabian-gp/race#athlete/nikita-mazepin.meas.fastest_lap_ms"
    },
    {
      "event": "f1/2021/wc/r22-abu-dhabi-gp",
      "date": "2021-12-12",
      "ref": "kos:f1/2021/wc/r22-abu-dhabi-gp/race#athlete/nikita-mazepin.perf.pit_stops"
    }
  ],
  "series": {},
  "coverage": {
    "result": {
      "status": "full",
      "floor": "1950",
      "note": "f1db CC BY backbone: every world-championship session 1950-present."
    },
    "perf": {
      "status": "partial",
      "floor": "1994",
      "note": "Pit-stop counts from f1db's pit-stop data era (1994+); earlier races have no per-stop records.",
      "wouldUnblock": "A licensed historical pit-stop dataset for pre-1994 seasons."
    },
    "form": {
      "status": "full",
      "floor": "1950",
      "note": "Drivers' standings after every round, f1db 1950-present."
    },
    "cond": {
      "status": "partial",
      "floor": "1950",
      "note": "Open-Meteo hourly reanalysis joined by venue coordinates; model estimate at the venue, not track-side sensor data.",
      "proxies": [
        "cond.temp_c",
        "cond.precip_mm",
        "cond.wind_kmh"
      ]
    },
    "avail": {
      "status": "none",
      "note": "No keyless personnel-status feed exists for F1; driver substitutions surface only post-hoc in results.",
      "wouldUnblock": "A licensed entry-list/withdrawal feed."
    },
    "market": {
      "status": "partial",
      "floor": "2024",
      "note": "Prediction markets (Polymarket) 2024-present only; no keyless bookmaker odds history for F1. Public per owner decision 2026-07-19 (OQ #6 closed: rights unlocated, not denied); excluded from commercial delivery.",
      "wouldUnblock": "A licensed historical odds feed would extend the floor past 2024."
    },
    "meas": {
      "status": "partial",
      "floor": "1950",
      "note": "Fastest race lap from f1db (stepped horizon: timing precision improves by era). Speed-trap and telemetry measurements have no license-clean source (SR G7).",
      "wouldUnblock": "A licensed telemetry/speed-trap dataset."
    },
    "agg": {
      "status": "full",
      "floor": "1950",
      "note": "f1db source-published driver season and career totals; independent cross-check for card-derived aggregates."
    },
    "h2h": {
      "status": "full",
      "note": "Derived-only from stored result rows over shared events; no stored metric (OM §14.1)."
    }
  }
}
