{
  "$schema": "https://cdn.jsdelivr.net/gh/forge-arcana/kos-data@main/schema/athlete.schema.json",
  "dataset": "athlete",
  "sport": "f1",
  "entity": "athlete/andy-linden",
  "updated": "2026-09-27T15:53:47.830Z",
  "sources": [
    "f1db"
  ],
  "identity": {
    "name": "Andy Linden",
    "aliases": [],
    "qid": "Q172574",
    "country": "USA",
    "dob": "1922-04-05",
    "sourceIds": {
      "f1db": "andy-linden"
    }
  },
  "aggregates": [
    {
      "metric": "agg.championships",
      "scope": "career",
      "value": 0,
      "unit": "count",
      "provenance": "sourced",
      "cites": [
        "kos:f1/career/2026-09-27#athlete/andy-linden.agg.championships"
      ]
    },
    {
      "metric": "agg.fastest_laps",
      "scope": "career",
      "value": 0,
      "unit": "count",
      "provenance": "sourced",
      "cites": [
        "kos:f1/career/2026-09-27#athlete/andy-linden.agg.fastest_laps"
      ]
    },
    {
      "metric": "agg.podiums",
      "scope": "career",
      "value": 0,
      "unit": "count",
      "provenance": "sourced",
      "cites": [
        "kos:f1/career/2026-09-27#athlete/andy-linden.agg.podiums"
      ]
    },
    {
      "metric": "agg.points",
      "scope": "career",
      "value": 5,
      "unit": "points",
      "provenance": "sourced",
      "cites": [
        "kos:f1/career/2026-09-27#athlete/andy-linden.agg.points"
      ]
    },
    {
      "metric": "agg.poles",
      "scope": "career",
      "value": 0,
      "unit": "count",
      "provenance": "sourced",
      "cites": [
        "kos:f1/career/2026-09-27#athlete/andy-linden.agg.poles"
      ]
    },
    {
      "metric": "agg.starts",
      "scope": "career",
      "value": 7,
      "unit": "count",
      "provenance": "sourced",
      "cites": [
        "kos:f1/career/2026-09-27#athlete/andy-linden.agg.starts"
      ]
    },
    {
      "metric": "agg.wins",
      "scope": "career",
      "value": 0,
      "unit": "count",
      "provenance": "sourced",
      "cites": [
        "kos:f1/career/2026-09-27#athlete/andy-linden.agg.wins"
      ]
    },
    {
      "metric": "agg.points",
      "scope": "f1/1951",
      "value": 3,
      "unit": "points",
      "provenance": "sourced",
      "cites": [
        "kos:f1/1951#athlete/andy-linden.agg.points@season"
      ]
    },
    {
      "metric": "agg.points",
      "scope": "f1/1957",
      "value": 2,
      "unit": "points",
      "provenance": "sourced",
      "cites": [
        "kos:f1/1957#athlete/andy-linden.agg.points@season"
      ]
    },
    {
      "metric": "win_rate",
      "scope": "career",
      "value": 0,
      "provenance": "derived",
      "derivation": "win_rate@1.0.0",
      "rowCount": 7,
      "cites": []
    }
  ],
  "recent": [
    {
      "event": "f1/1953/wc/r02-indy-500",
      "date": "1953-05-30",
      "position": 16,
      "ref": "kos:f1/1953/wc/r02-indy-500/race#athlete/andy-linden.result.position"
    },
    {
      "event": "f1/1954/wc/r02-indy-500",
      "date": "1954-05-31",
      "position": 11,
      "ref": "kos:f1/1954/wc/r02-indy-500/race#athlete/andy-linden.result.position"
    },
    {
      "event": "f1/1955/wc/r03-indy-500",
      "date": "1955-05-30",
      "position": 6,
      "ref": "kos:f1/1955/wc/r03-indy-500/race#athlete/andy-linden.result.position"
    },
    {
      "event": "f1/1956/wc/r03-indy-500",
      "date": "1956-05-30",
      "position": 27,
      "ref": "kos:f1/1956/wc/r03-indy-500/race#athlete/andy-linden.result.position"
    },
    {
      "event": "f1/1957/wc/r03-indy-500",
      "date": "1957-05-30",
      "position": 5,
      "ref": "kos:f1/1957/wc/r03-indy-500/race#athlete/andy-linden.result.position"
    }
  ],
  "series": {},
  "coverage": {
    "result": {
      "status": "full",
      "floor": "1950",
      "note": "f1db CC BY backbone: every world-championship session 1950-present."
    },
    "perf": {
      "status": "partial",
      "floor": "1994",
      "note": "Pit-stop counts from f1db's pit-stop data era (1994+); earlier races have no per-stop records.",
      "wouldUnblock": "A licensed historical pit-stop dataset for pre-1994 seasons."
    },
    "form": {
      "status": "full",
      "floor": "1950",
      "note": "Drivers' standings after every round, f1db 1950-present."
    },
    "cond": {
      "status": "partial",
      "floor": "1950",
      "note": "Open-Meteo hourly reanalysis joined by venue coordinates; model estimate at the venue, not track-side sensor data.",
      "proxies": [
        "cond.temp_c",
        "cond.precip_mm",
        "cond.wind_kmh"
      ]
    },
    "avail": {
      "status": "none",
      "note": "No keyless personnel-status feed exists for F1; driver substitutions surface only post-hoc in results.",
      "wouldUnblock": "A licensed entry-list/withdrawal feed."
    },
    "market": {
      "status": "partial",
      "floor": "2024",
      "note": "Prediction markets (Polymarket) 2024-present only; no keyless bookmaker odds history for F1. Public per owner decision 2026-07-19 (OQ #6 closed: rights unlocated, not denied); excluded from commercial delivery.",
      "wouldUnblock": "A licensed historical odds feed would extend the floor past 2024."
    },
    "meas": {
      "status": "partial",
      "floor": "1950",
      "note": "Fastest race lap from f1db (stepped horizon: timing precision improves by era). Speed-trap and telemetry measurements have no license-clean source (SR G7).",
      "wouldUnblock": "A licensed telemetry/speed-trap dataset."
    },
    "agg": {
      "status": "full",
      "floor": "1950",
      "note": "f1db source-published driver season and career totals; independent cross-check for card-derived aggregates."
    },
    "h2h": {
      "status": "full",
      "note": "Derived-only from stored result rows over shared events; no stored metric (OM §14.1)."
    }
  }
}
