{
  "$schema": "https://cdn.jsdelivr.net/gh/forge-arcana/kos-data@main/schema/athlete.schema.json",
  "dataset": "athlete",
  "sport": "f1",
  "entity": "athlete/roy-salvadori",
  "updated": "2026-10-26T17:45:17.280Z",
  "sources": [
    "f1db"
  ],
  "identity": {
    "name": "Roy Salvadori",
    "aliases": [],
    "qid": "Q171717",
    "country": "GBR",
    "dob": "1922-05-12",
    "sourceIds": {
      "f1db": "roy-salvadori"
    }
  },
  "aggregates": [
    {
      "metric": "agg.championships",
      "scope": "career",
      "value": 0,
      "unit": "count",
      "provenance": "sourced",
      "cites": [
        "kos:f1/career/2026-10-26#athlete/roy-salvadori.agg.championships"
      ]
    },
    {
      "metric": "agg.fastest_laps",
      "scope": "career",
      "value": 0,
      "unit": "count",
      "provenance": "sourced",
      "cites": [
        "kos:f1/career/2026-10-26#athlete/roy-salvadori.agg.fastest_laps"
      ]
    },
    {
      "metric": "agg.podiums",
      "scope": "career",
      "value": 2,
      "unit": "count",
      "provenance": "sourced",
      "cites": [
        "kos:f1/career/2026-10-26#athlete/roy-salvadori.agg.podiums"
      ]
    },
    {
      "metric": "agg.points",
      "scope": "career",
      "value": 19,
      "unit": "points",
      "provenance": "sourced",
      "cites": [
        "kos:f1/career/2026-10-26#athlete/roy-salvadori.agg.points"
      ]
    },
    {
      "metric": "agg.poles",
      "scope": "career",
      "value": 0,
      "unit": "count",
      "provenance": "sourced",
      "cites": [
        "kos:f1/career/2026-10-26#athlete/roy-salvadori.agg.poles"
      ]
    },
    {
      "metric": "agg.starts",
      "scope": "career",
      "value": 47,
      "unit": "count",
      "provenance": "sourced",
      "cites": [
        "kos:f1/career/2026-10-26#athlete/roy-salvadori.agg.starts"
      ]
    },
    {
      "metric": "agg.wins",
      "scope": "career",
      "value": 0,
      "unit": "count",
      "provenance": "sourced",
      "cites": [
        "kos:f1/career/2026-10-26#athlete/roy-salvadori.agg.wins"
      ]
    },
    {
      "metric": "agg.points",
      "scope": "f1/1957",
      "value": 2,
      "unit": "points",
      "provenance": "sourced",
      "cites": [
        "kos:f1/1957#athlete/roy-salvadori.agg.points@season"
      ]
    },
    {
      "metric": "agg.points",
      "scope": "f1/1958",
      "value": 15,
      "unit": "points",
      "provenance": "sourced",
      "cites": [
        "kos:f1/1958#athlete/roy-salvadori.agg.points@season"
      ]
    },
    {
      "metric": "agg.points",
      "scope": "f1/1961",
      "value": 2,
      "unit": "points",
      "provenance": "sourced",
      "cites": [
        "kos:f1/1961#athlete/roy-salvadori.agg.points@season"
      ]
    },
    {
      "metric": "podiums",
      "scope": "career",
      "value": 2,
      "provenance": "derived",
      "derivation": "podiums@1.0.0",
      "rowCount": 2,
      "cites": [
        "kos:f1/1958/wc/r07-british-gp/race#athlete/roy-salvadori.result.position",
        "kos:f1/1958/wc/r08-german-gp/race#athlete/roy-salvadori.result.position"
      ]
    },
    {
      "metric": "win_rate",
      "scope": "career",
      "value": 0,
      "provenance": "derived",
      "derivation": "win_rate@1.0.0",
      "rowCount": 49,
      "cites": []
    }
  ],
  "recent": [
    {
      "event": "f1/1962/wc/r05-british-gp",
      "date": "1962-07-21",
      "ref": "kos:f1/1962/wc/r05-british-gp/race#athlete/roy-salvadori.result.grid"
    },
    {
      "event": "f1/1962/wc/r06-german-gp",
      "date": "1962-08-05",
      "ref": "kos:f1/1962/wc/r06-german-gp/race#athlete/roy-salvadori.result.grid"
    },
    {
      "event": "f1/1962/wc/r07-italian-gp",
      "date": "1962-09-16",
      "ref": "kos:f1/1962/wc/r07-italian-gp/race#athlete/roy-salvadori.result.grid"
    },
    {
      "event": "f1/1962/wc/r08-united-states-gp",
      "date": "1962-10-07",
      "ref": "kos:f1/1962/wc/r08-united-states-gp/race#athlete/roy-salvadori.result.reason_retired"
    },
    {
      "event": "f1/1962/wc/r09-south-african-gp",
      "date": "1962-12-29",
      "ref": "kos:f1/1962/wc/r09-south-african-gp/race#athlete/roy-salvadori.result.grid"
    }
  ],
  "series": {},
  "coverage": {
    "result": {
      "status": "full",
      "floor": "1950",
      "note": "f1db CC BY backbone: every world-championship session 1950-present."
    },
    "perf": {
      "status": "partial",
      "floor": "1994",
      "note": "Pit-stop counts from f1db's pit-stop data era (1994+); earlier races have no per-stop records.",
      "wouldUnblock": "A licensed historical pit-stop dataset for pre-1994 seasons."
    },
    "form": {
      "status": "full",
      "floor": "1950",
      "note": "Drivers' standings after every round, f1db 1950-present."
    },
    "cond": {
      "status": "partial",
      "floor": "1950",
      "note": "Open-Meteo hourly reanalysis joined by venue coordinates; model estimate at the venue, not track-side sensor data.",
      "proxies": [
        "cond.temp_c",
        "cond.precip_mm",
        "cond.wind_kmh"
      ]
    },
    "avail": {
      "status": "none",
      "note": "No keyless personnel-status feed exists for F1; driver substitutions surface only post-hoc in results.",
      "wouldUnblock": "A licensed entry-list/withdrawal feed."
    },
    "market": {
      "status": "partial",
      "floor": "2024",
      "note": "Prediction markets (Polymarket) 2024-present only; no keyless bookmaker odds history for F1. Public per owner decision 2026-07-19 (OQ #6 closed: rights unlocated, not denied); excluded from commercial delivery.",
      "wouldUnblock": "A licensed historical odds feed would extend the floor past 2024."
    },
    "meas": {
      "status": "partial",
      "floor": "1950",
      "note": "Fastest race lap from f1db (stepped horizon: timing precision improves by era). Speed-trap and telemetry measurements have no license-clean source (SR G7).",
      "wouldUnblock": "A licensed telemetry/speed-trap dataset."
    },
    "agg": {
      "status": "full",
      "floor": "1950",
      "note": "f1db source-published driver season and career totals; independent cross-check for card-derived aggregates."
    },
    "h2h": {
      "status": "full",
      "note": "Derived-only from stored result rows over shared events; no stored metric (OM §14.1)."
    }
  }
}
