{
  "$schema": "https://cdn.jsdelivr.net/gh/forge-arcana/kos-data@main/schema/athlete.schema.json",
  "dataset": "athlete",
  "sport": "f1",
  "entity": "athlete/gregor-foitek",
  "updated": "2026-09-27T15:53:48.072Z",
  "sources": [
    "f1db"
  ],
  "identity": {
    "name": "Gregor Foitek",
    "aliases": [],
    "qid": "Q171725",
    "country": "CHE",
    "dob": "1965-03-27",
    "sourceIds": {
      "f1db": "gregor-foitek"
    }
  },
  "aggregates": [
    {
      "metric": "agg.championships",
      "scope": "career",
      "value": 0,
      "unit": "count",
      "provenance": "sourced",
      "cites": [
        "kos:f1/career/2026-09-27#athlete/gregor-foitek.agg.championships"
      ]
    },
    {
      "metric": "agg.fastest_laps",
      "scope": "career",
      "value": 0,
      "unit": "count",
      "provenance": "sourced",
      "cites": [
        "kos:f1/career/2026-09-27#athlete/gregor-foitek.agg.fastest_laps"
      ]
    },
    {
      "metric": "agg.podiums",
      "scope": "career",
      "value": 0,
      "unit": "count",
      "provenance": "sourced",
      "cites": [
        "kos:f1/career/2026-09-27#athlete/gregor-foitek.agg.podiums"
      ]
    },
    {
      "metric": "agg.points",
      "scope": "career",
      "value": 0,
      "unit": "points",
      "provenance": "sourced",
      "cites": [
        "kos:f1/career/2026-09-27#athlete/gregor-foitek.agg.points"
      ]
    },
    {
      "metric": "agg.poles",
      "scope": "career",
      "value": 0,
      "unit": "count",
      "provenance": "sourced",
      "cites": [
        "kos:f1/career/2026-09-27#athlete/gregor-foitek.agg.poles"
      ]
    },
    {
      "metric": "agg.starts",
      "scope": "career",
      "value": 7,
      "unit": "count",
      "provenance": "sourced",
      "cites": [
        "kos:f1/career/2026-09-27#athlete/gregor-foitek.agg.starts"
      ]
    },
    {
      "metric": "agg.wins",
      "scope": "career",
      "value": 0,
      "unit": "count",
      "provenance": "sourced",
      "cites": [
        "kos:f1/career/2026-09-27#athlete/gregor-foitek.agg.wins"
      ]
    },
    {
      "metric": "win_rate",
      "scope": "career",
      "value": 0,
      "provenance": "derived",
      "derivation": "win_rate@1.0.0",
      "rowCount": 7,
      "cites": []
    }
  ],
  "recent": [
    {
      "event": "f1/1990/wc/r03-san-marino-gp",
      "date": "1990-05-13",
      "ref": "kos:f1/1990/wc/r03-san-marino-gp/race#athlete/gregor-foitek.meas.fastest_lap_ms"
    },
    {
      "event": "f1/1990/wc/r04-monaco-gp",
      "date": "1990-05-27",
      "position": 7,
      "ref": "kos:f1/1990/wc/r04-monaco-gp/race#athlete/gregor-foitek.result.position"
    },
    {
      "event": "f1/1990/wc/r05-canadian-gp",
      "date": "1990-06-10",
      "ref": "kos:f1/1990/wc/r05-canadian-gp/race#athlete/gregor-foitek.meas.fastest_lap_ms"
    },
    {
      "event": "f1/1990/wc/r06-mexican-gp",
      "date": "1990-06-24",
      "position": 15,
      "ref": "kos:f1/1990/wc/r06-mexican-gp/race#athlete/gregor-foitek.result.position"
    },
    {
      "event": "f1/1990/wc/r09-german-gp",
      "date": "1990-07-29",
      "ref": "kos:f1/1990/wc/r09-german-gp/race#athlete/gregor-foitek.meas.fastest_lap_ms"
    }
  ],
  "series": {},
  "coverage": {
    "result": {
      "status": "full",
      "floor": "1950",
      "note": "f1db CC BY backbone: every world-championship session 1950-present."
    },
    "perf": {
      "status": "partial",
      "floor": "1994",
      "note": "Pit-stop counts from f1db's pit-stop data era (1994+); earlier races have no per-stop records.",
      "wouldUnblock": "A licensed historical pit-stop dataset for pre-1994 seasons."
    },
    "form": {
      "status": "full",
      "floor": "1950",
      "note": "Drivers' standings after every round, f1db 1950-present."
    },
    "cond": {
      "status": "partial",
      "floor": "1950",
      "note": "Open-Meteo hourly reanalysis joined by venue coordinates; model estimate at the venue, not track-side sensor data.",
      "proxies": [
        "cond.temp_c",
        "cond.precip_mm",
        "cond.wind_kmh"
      ]
    },
    "avail": {
      "status": "none",
      "note": "No keyless personnel-status feed exists for F1; driver substitutions surface only post-hoc in results.",
      "wouldUnblock": "A licensed entry-list/withdrawal feed."
    },
    "market": {
      "status": "partial",
      "floor": "2024",
      "note": "Prediction markets (Polymarket) 2024-present only; no keyless bookmaker odds history for F1. Public per owner decision 2026-07-19 (OQ #6 closed: rights unlocated, not denied); excluded from commercial delivery.",
      "wouldUnblock": "A licensed historical odds feed would extend the floor past 2024."
    },
    "meas": {
      "status": "partial",
      "floor": "1950",
      "note": "Fastest race lap from f1db (stepped horizon: timing precision improves by era). Speed-trap and telemetry measurements have no license-clean source (SR G7).",
      "wouldUnblock": "A licensed telemetry/speed-trap dataset."
    },
    "agg": {
      "status": "full",
      "floor": "1950",
      "note": "f1db source-published driver season and career totals; independent cross-check for card-derived aggregates."
    },
    "h2h": {
      "status": "full",
      "note": "Derived-only from stored result rows over shared events; no stored metric (OM §14.1)."
    }
  }
}
